"customer_id","review_id","product_id","product_parent","product_title","product_category","star_rating","helpful_votes","total_votes","verified_purchase","review_headline","review_body","review_date","marketplace","year"
"13069613","RWB85TRJPI5Z1","B0041LG08U","377907320","Seiko Men's SNZH53 Seiko 5 Automatic Dark Blue Dial Stainless Steel Watch","Watches","4","2","2","Y","Great watch, subpar bracelet","The SNZH53 is a very good automatic watch at its price point. It keeps good time, has a decent power reserve and the deep blue of the face and bezel is very pretty. The crystal is fairly scratch resistant. Not as good as high end watches, but the hardlex will prevent all but the hardest bangs from leaving a mark. The worst thing about this watch is the bracelet. It feels light and cheap. If you're planning to wear it on an aftermarket strap, as I do, that's not an issue. Though it's a &#34;divers watch&#34; it doesn't have a screw-down crown so it's not really great for doing a lot of underwater wear. That said, I've gone swimming with it on and had no ill effects.","2015-08-31","US","2015"
"33923529","R102628UTIS8PD","B004PKTU5M","317306776","Bellefit Postpartum Girdle with Zipper, Medical-Grade, Compression & Support","Apparel","3","0","3","Y","The Bellefit people have sent me an email to let me know they strive for excellent customer service","Too small. I couldn't even pull it on to try this belt on but it was a hassle free return. The Bellefit people have sent me an email to let me know they strive for excellent customer service. Wish stores sold this product so I can try it on in person for correct sizing","2015-08-31","US","2015"
"34831859","R183D7E2WM33XE","B009KWU6Q2","560423029","Hook","Digital_Video_Download","4","1","1","Y","Good family movie","Good family movie.  It's fairly long, making it a little tough for kids with a short attention span.","2015-08-31","US","2015"
"23583629","R9LOP49WTNCC9","B00004RJ71","658720709","Blood In, Blood Out","Video DVD","5","0","0","Y","Five Stars","Good movie","2015-08-31","US","2015"
"26211978","R1YYD5SR2E7IJ9","B00LD1OHE0","556487837","Confess: A Novel","Digital_Ebook_Purchase","5","0","0","Y","Five Stars","Great book! Couldn't put it down!","2015-08-31","US","2015"
"21676546","R33ZMJPM5KYLXA","B006BDHAX0","905340518","Mahjong Deluxe HD","Mobile_Apps","5","0","0","Y","Five Stars","It is fun to play on my Kindle in the evenings as TV has sucked lately.","2015-08-31","US","2015"
"21463959","R1HENLLE9MQ1M2","B001J6OMM6","249926549","Maidenform Women's Custom Lift Tailored Satin Demi Bra","Apparel","1","0","0","Y","Not for me","This bra is cheap and doesn't fit well.  I'm returning it.","2015-08-31","US","2015"
"35539516","RMPE4WCEIEBKA","B007944TE8","973845141","In Treatment: Season 2","Digital_Video_Download","5","0","0","Y","Five Stars","Superb writing and acting.","2015-08-31","US","2015"
"26338037","RD7TD50O4BQTX","B00ES29WSC","725864791","Tuesdays with Morrie: an Old Man, a Young Man, and Life's Greatest Lesson, 1st edition","Books","5","0","0","Y","such a great book!","item as described. such a great book!","2015-08-31","US","2015"
"26087382","R3J88BPK7HM5R9","B006885LZM","224139336","The Pacific Season 1","Digital_Video_Download","5","0","0","Y","Five Stars","Great mini series....have watched and enjoyed several times.","2015-08-31","US","2015"
"26739366","R2IBZD4PQK17DF","B0040I09RM","117036067","Sons of Anarchy Season 1","Digital_Video_Download","5","0","0","Y","Five Stars","Awesome!","2015-08-31","US","2015"
"39833477","R2QNS9M4IOM55E","B00BH0VSM6","40427521","The Bat: A Harry Hole Novel (1) (Harry Hole Series)","Digital_Ebook_Purchase","3","0","0","Y","An innocent Harry Hole?","Not near as good as his later books.  Harry Hole is a much different character in this one and that's not a good thing.","2015-08-31","US","2015"
"18432566","R3DLDVH4MOVH8Y","B007944TE8","973845141","In Treatment: Season 2","Digital_Video_Download","4","0","0","Y","thoughtful entertainment","Enjoyed season two almost as much as season one. Interesting story lines and characters. Binge-worthy!","2015-08-31","US","2015"
"14429701","R2UJWLN21EM8NQ","B00E8KLWB4","488246640","The Secret Society® - Hidden Mystery","Mobile_Apps","4","0","0","Y","love","Wish the Facebook version had magnifer.","2015-08-31","US","2015"
"46343695","R3YJPJCRKZRG6","B00FAPF5U0","46324555","Candy Crush Saga","Mobile_Apps","5","0","0","Y","love","Love this app","2015-08-31","US","2015"
"4347805","R2ZBOSAQAJ4FTZ","B009ZFPQOQ","731856548","Waze Social GPS, Maps & Traffic","Mobile_Apps","5","0","0","Y","extremely helpful","Having to shuttle kids from school to practices almost six days a week this app shortens every trip.","2015-08-31","US","2015"
"42880460","R2Q0BTIN9I1AE0","3869930691","219967210","Bloodborne Collector's Edition Strategy Guide","Books","5","0","0","Y","Five Stars","Amazing art, helpful maps, as well as giving a basic guide of the order you should visit each area","2015-08-31","US","2015"
"38392832","R2DKBF0HU9LO0E","B00M7UTFW0","109782764","Noah","Digital_Video_Download","1","0","0","Y","One Star","Worst movie ever","2015-08-31","US","2015"
"258788","R8ZV2A0BCR31B","B004NP2MN6","317199757","Dickies Scrubs Women's 82408 Gen Flex Junior Fit Contrast Stitch Lab Coat","Apparel","5","0","0","Y","Five Stars","Very pleased with the fit and quality.","2015-08-31","US","2015"
"25104474","R1JIKTNAVLPOEJ","B004MNKEIY","881588715","Smiffy's Women's Tequila Shooter Girl Dress","Apparel","5","1","1","Y","Good quality, good fit.","Very cute, fit just as expected. I was worried that it may too short but it wasn't. The white top is very see through so I will have to wear something under it but overall I really like it.","2015-08-31","US","2015"
"30122041","RNUHCJTNAW7ME","B0091VZCES","30281088","The Adventures of Robin Hood (1938)","Digital_Video_Download","5","0","1","Y","Must have for the family","A classic that kids should get to watch","2015-08-31","US","2015"
"36076198","R1BH2UVAXTR54R","0307887448","769273676","Ready Player One: A Novel","Books","5","0","0","Y","A Must Read!","Anyone who was born or raised in the 80's, and is a self described nerd or geek, will definitely love this book. Tons of references, virtual reality, and excellent writing so you can truly picture what the author's telling you. Definitely read this before the movie comes out in 2017.","2015-08-31","US","2015"
"25225549","R3C3V50DDD2LFP","B009U9S6FI","885790086","Man's Search for Meaning","Digital_Ebook_Purchase","5","0","0","Y","An inspiring book that I would recommend to everyone","The best book about happiness and meaning of live that I've read. This book will forever change my view about life and suffering.","2015-08-31","US","2015"
"19516078","R3ADPSFMT1JIL8","B004GJDQT8","36653526","Amazon Underground","Mobile_Apps","1","0","0","N","Won't download","I tried to download this but it won't give me the option to. I clicked the link on one of the games and I can't get it. Please fix. Using a LG tablet","2015-08-31","US","2015"
"47594244","RI452XC84Y5MP","B004Y1WCDE","948344990","Plex","Mobile_Apps","5","0","0","Y","LOVE LOVE LOVE this app","LOVE LOVE LOVE this app.  I use it to chromecast my personal video library to any TV in the house.","2015-08-31","US","2015"
"10909402","R3DFQO9TYA6T6N","B005CAPS0K","540640723","Insidious","Digital_Video_Download","5","0","1","Y","Five Stars","AWESOME!!!!","2015-08-31","US","2015"
"14344771","RCLURMP3YZ2MR","B00B000O8C","268103724","Dead Medium: Not Your Average Ghost Story","Digital_Ebook_Purchase","5","1","1","Y","I loved the book and the settings used","I loved the description in the prologue &#34;a chill rasped through the air, though there was no wind to carry it.&#34; I am gonna use a prologue in my sequel book. I loved the description of May and how she tried to cope with being dead. I would like to know what brokewell is? It is a great read that I would recommend.","2015-08-31","US","2015"
"5596610","R2T4N4CT2HT0Z2","B00JB3MVCW","109782764","Noah","Digital_Video_Download","1","0","0","N","NOT Based on the BIBLE!!","Did not like this movie!  Was expecting a Biblical rendition . .  not fictional.  This will totally confuse people that are looking for the truth through a movie rather than through reading/study.","2015-08-31","US","2015"
"1092397","R2T7019HY2973Y","B00NGYBMOK","208698540","Maps for Kindle Fire Free","Mobile_Apps","3","0","0","Y","Three Stars","Would like to see alternate routes in directions.","2015-08-31","US","2015"
"3857939","R15G37MA1WIEGE","B009AP4MGE","753677399","Glee Season 4","Digital_Video_Download","5","0","0","Y","Five Stars","Love it","2015-08-31","US","2015"
"32113012","RO72OD5QI1PE9","B00794ML3Y","736777616","In Treatment Season 1","Digital_Video_Download","4","0","0","Y","Four Stars","He's a great therapist some episodes and a lousy one on others. Entertaining.","2015-08-31","US","2015"
"46656638","R3KVT6T49HFER8","B004J4WLB4","150581703","The Language of Flowers: A Novel","Digital_Ebook_Purchase","4","0","0","N","A true insight into foster care and what it does ...","A true insight into foster care and what it does to a child's self concept.  And the effects for a lifetime.","2015-08-31","US","2015"
"15413170","R129U8D5TGJ5BJ","B007FEFLTO","801837857","Winter of the World (The Century Trilogy, Book 2)","Digital_Ebook_Purchase","5","0","0","Y","Five Stars","Excellent. Should be required reading in schools.","2015-08-31","US","2015"
"19206758","R3AUQN4L0TL1S3","B00IFORVEQ","731881208","Veronica Mars","Digital_Video_Download","5","0","0","Y","Oh how I miss this series","Love Veronica Mars","2015-08-31","US","2015"
"40541552","R19ZSBWPB2SHM9","B00KNWYDU8","779873629","Dragon City","Mobile_Apps","5","0","0","Y","Great app for kids","Great app. One of our grand kids loves it, and has become very good at it. Will keep children occupied for a long time.","2015-08-31","US","2015"
"22825352","RDXTEUJ8S19TV","B00JOT3HQ2","545270466","Geometry Dash Lite","Mobile_Apps","5","0","0","Y","Awesome","Awesome<br />Awesome<br />Awesome","2015-08-31","US","2015"
"14508295","R30JPE3H23KHYE","B000SDVOM2","776067145","MFH BDU Ripstop Field Cap Black size S","Apparel","3","0","0","Y","Three Stars","Good Quality, Fits small.","2015-08-31","US","2015"
"37555960","R1X5670OQ1DY4O","B00MILGKPI","600191340","Teenage Mutant Ninja Turtles","Digital_Video_Download","4","0","0","Y","Four Stars","Fun movie!","2015-08-31","US","2015"
"33072202","R2NQOD94S0JW88","B003K15IF8","74470286","Stoner (New York Review Books Classics)","Digital_Ebook_Purchase","4","0","1","Y","Four Stars","Excellent","2015-08-31","US","2015"
"16274513","RLYSBNHGV1SVH","B00881VLCE","76742616","Magic Jigsaw Puzzles","Mobile_Apps","5","0","0","Y","Relaxing fun","Lots of fun. Challenging , Takes ( 1 puzzle) me about 1 hr. to complete. Then you say cool !","2015-08-31","US","2015"
"36356088","R3L61CC6TF204P","B000M5B6Q0","182319267","Music and Lyrics","Music","5","0","0","Y","Five Stars","Excellentes musiques, excellents acteurs. On retrouve le film avec attachement en écoutant ce CD !","2015-08-31","US","2015"
"37050077","R50DMLJ7P2DB1","B000J6I0U2","736719325","Casanova [Blu-ray]","Video DVD","5","0","1","Y","Repeat Title capability","Repeat &#34;title&#34; function actually works. This is one of the rare blu ray dvds i've bought in a while that does not force me to have to mess with a remote at the end of the film if i want the title to repeat. Virtually all of my regular dvds will repeat with no trouble but that function is rarely enabled when they master the blu ray dvds.","2015-08-31","US","2015"
"30572290","RXWYQFYGEHEFX","B0063GORYU","750174226","Spider","Mobile_Apps","1","0","0","Y","One Star","Tooooooo many ads!","2015-08-31","US","2015"
"26831834","R13UQDRIKJNMBP","B0051UP5NQ","2686360","OfficeSuite Professional","Mobile_Apps","4","0","0","Y","app performs as expected.","Although I am proficient with Microsoft office, this app is not as intuitive. Took quite a bit of exploring to find the corresponding functions in this app.","2015-08-31","US","2015"
"41881349","R1ZF9GJGGWX4IG","B00C8S9W0G","311878254","Written in My Own Heart's Blood: A Novel (Outlander, Book 8)","Digital_Ebook_Purchase","5","1","1","Y","A real treat for Outlander fans","Fans of the Outlander series need no excuse to gobble up this next episode! Full of all the beloved characters of Jamie and Claire expanding family, this book satisfies the desire to get lost in the story. Packed full of historical details, the book makes fact-based characters sing along to the wonderful Outlander tune.","2015-08-31","US","2015"
"27836242","RJF59OB7O85K8","B00LTMIHVW","324449729","Under the Skin","Digital_Video_Download","4","0","1","Y","OK; worth watching","A bit slow, but interesting. Good if you're in the mood for something different.","2015-08-31","US","2015"
"19788607","R14ZLSIXCC50N8","B00E8KLWB4","488246640","The Secret Society® - Hidden Mystery","Mobile_Apps","5","0","0","Y","love it","I play this game almost daily, it's a lot of fun!!!","2015-08-31","US","2015"
"52166791","R1F5N4ZB52RKIX","B00I8H7APK","387216150","About Time","Digital_Video_Download","4","1","1","Y","A feel good movie that leave you with a great outlook on life.","A warm , sweet, inspiring story.","2015-08-31","US","2015"
"24429456","R1IM1QY63FFIZ5","B000PC0SPU","396856567","A Whole New Mind: Why Right-Brainers Will Rule the Future","Digital_Ebook_Purchase","4","1","1","Y","Probably one of the most informative reads I've read in ...","Probably one of the most informative reads I've read in quite a while.  The trends noted therein have become more relevant with each passing year.","2015-08-31","US","2015"
"35800640","R2PNYNV685S376","B00008G9JN","194313454","Songs From The Wood","Music","5","0","0","Y","Five Stars","Great old album.","2015-08-31","US","2015"
"20637854","R2B9L0S85TRHY8","B011KKE5OK","718553378","Ex Machina","Digital_Video_Download","4","1","1","Y","AI and humanity....","visual effects were great. the topic of artificial intelligence becoming self aware and a genius developer 'evolving' the models is quite interesting. There are a few kinks in the story line but thats a problem with most films, isn't it. I did enjoy it and as SCIFI fan can recommend it wholeheartedly.","2015-08-31","US","2015"
"14347484","R30DJ1ZL73BL89","B00T3DNKIE","652741483","Go Set a Watchman: A Novel","Digital_Ebook_Purchase","4","0","1","Y","Great book!","A fitting sequel to her first classic.  Hard hitting, made me question what I thought I believed.  Great book!","2015-08-31","US","2015"
"44597454","R16N0EXHGL1PTN","0062409859","652741483","Go Set a Watchman: A Novel","Books","2","2","2","Y","Two Stars","Not a good read and really not what I expected.","2015-08-31","US","2015"
"52186629","R3MRD7UBAIMPOK","B007V693YK","929969420","Songsterr Guitar Tabs & Chords","Mobile_Apps","5","0","0","Y","Great for Beginners","Very helpful when learning.","2015-08-31","US","2015"
"35918482","R2AE6PLO3SBOLJ","B00701L5XS","102188073","Knots 3D","Mobile_Apps","5","0","0","Y","Best knot app!!  If you need to tie knots get this app.","This 3D app makes it extremely easy to see which end of the rope your working with which is the most difficult thing to visualize when tying knots.  There are also more knots in this app then you will probably ever use.  GREAT APP!!!","2015-08-31","US","2015"
"2714679","R31A0RHTSM4OIH","B004GJDQT8","36653526","Amazon Underground","Mobile_Apps","1","0","0","Y","No download link appears.","No download link for apps, and say update amazon underground every time.","2015-08-31","US","2015"
"52952484","R2N7ZVCJN19L2M","B00N35P5MW","993977887","Montezuma Puzzle 3 Premium","Mobile_Apps","4","0","0","Y","Montezuma","Nice app.  Can be challenging.","2015-08-31","US","2015"
"5524655","R1PG295RD3TLL","B00FE5N09Y","802053204","How I Met Your Mother: The Complete Series","Video DVD","5","0","2","Y","Five Stars","I love watching","2015-08-31","US","2015"
"52795389","R2R0WFTIFF6F40","B0063IH60K","414486782","Solitaire","Mobile_Apps","5","0","0","Y","My favorite app","I've been playing this version of Solitaire for several years. DEFINITELY my most-played game !!","2015-08-31","US","2015"
"33402015","RGUL3TYXYWOFH","B0064MPXFA","241785351","The Good Wife, Season 1","Digital_Video_Download","4","0","0","Y","Four Stars","I like it","2015-08-31","US","2015"
"29020555","R851PB5YZJ25D","0385486804","674569455","Into the Wild","Books","4","0","0","Y","Pretty interesting read about his thoughts on life and how ...","Different view on life is what Chris had.  Pretty interesting read about his thoughts on life and how he wanted to live.","2015-08-31","US","2015"
"40180990","R38H7H7AVSWTLY","B000JMKTLO","387357199","Sharp Objects: A Novel","Digital_Ebook_Purchase","4","0","0","N","Not the trifecta.","My least favorite of the three, but ironically the highest priced for the shortest length, and I feel cheated.<br /><br />Good story, but I knew the DX way before...well, no spoilers. And the conclusion was fairly transparent.  Still, I didn't put it down once I started so that says something.<br /><br />That's three Flynn books in 48-hours. Love her. Can't wait for more.","2015-08-31","US","2015"
"23501502","R124TWX163862H","B00IORP664","529216281","A Man Called Ove","Digital_Ebook_Purchase","5","0","0","Y","Awesome read.","A heartwarming book. It will make you laugh out loud one moment and cry the next. Awesome read.","2015-08-31","US","2015"
"47470004","R3JM5N0NHG2UMP","B006GLLXXK","630304580","True Blood: Season 1","Digital_Video_Download","1","0","0","Y","One Star","Absurd show!","2015-08-31","US","2015"
"43303533","R10L4K39032JNH","B00NEQRNVG","434155226","Captivated By You (Crossfire, Book 4)","Digital_Ebook_Purchase","5","0","0","Y","On the edge again!!!","This book is just as awesome as the 3 previous ones kept me on the edge of my seat read it all in a little over a day!! HIGHLY recommend this book  You will not be sorry!!!","2015-08-31","US","2015"
"45099563","R21UJYAC0OFVC9","B003DS9ECQ","971526666","Space Jam","Digital_Video_Download","5","0","1","Y","Five Stars","Best movie ever! Lol","2015-08-31","US","2015"
"22990056","R3R9SKOC5R770H","B0094LNSYG","780632864","Blade Runner: The Final Cut","Digital_Video_Download","5","0","0","Y","Five Stars","Great!","2015-08-31","US","2015"
"14304999","R208E23QN12HBE","B0007YXTP2","893585113","Playtex Women's 18-Hour Ultimate Lift And Support Wire-Free Bra","Apparel","3","0","0","Y","Three Stars","It doesn't last 18 hours for comfort but it does lift well.","2015-08-31","US","2015"
"40683364","R173DSTZA6VNWT","1512328677","781565906","The Little Prince: [Illustrated Edition]","Books","5","0","0","Y","What can you say about a Classic book?","The book is a Classic.  I'm in the process of reading it now.  I've wanted to get a copy ever since I heard about it in the 70s.","2015-08-31","US","2015"
"42982739","R2F62E90TCE504","B00SH00N3Y","647130552","Lucy","Digital_Video_Download","3","0","0","Y","Three Stars","meh","2015-08-31","US","2015"
"18165139","R44SDUKSOARTC","B009ZXT4BY","634768556","Survivalcraft Demo","Mobile_Apps","5","0","0","Y","worsy thi gy every","I love this game I litterly elves love love love it and its spool Coll. this is my fight sing. take back my life song","2015-08-31","US","2015"
"42090391","R1OLQX4WUITQQU","B00W6XM002","852949636","Candy Crush Soda Saga","Mobile_Apps","5","1","1","Y","Five Stars","Love playing this game","2015-08-31","US","2015"
"27933029","R3CL496IGCU8WZ","B00CRQV1TY","968604149","Wrote a Song for Everyone","Digital_Music_Purchase","5","0","0","Y","Five Stars","Love John Forgerty! Great music!","2015-08-31","US","2015"
"52160337","R1AP9CEURAVQMJ","B000SKNY96","133385500","Hanes Men's 6 Pack FreshIQ Full Cushion Ankle Socks, White, 10-13 (Shoe Size 6-12)","Apparel","4","0","0","Y","Could be thicker","Not as cushioned as I had hoped but they fit fine.","2015-08-31","US","2015"
"31350905","R19G4LKN74H70X","B003AIKE8M","578078179","Bravado Men's Rolling Stone T-Shirt","Apparel","4","0","0","Y","Four Stars","All's well","2015-08-31","US","2015"
"2765876","R3LFQHKWLLYYUK","B003CI55WK","614673291","Glitter Sequin Trim Cowboy Hat for Ladies","Apparel","5","3","3","Y","5 stars because customer service was excellent, problems w shipping and notified company who swiftly ...","5 stars because customer service was excellent, problems w shipping and notified company who swiftly credited my account. Will definitely buy again. Hat looks as expected was damaged on arrival by USPS, but as stated company fixed by crediting account. Hat itself would have been perfect, fit was good looked just like pic.","2015-08-31","US","2015"
"6547166","R1N27V4Y73PPFR","B003O86FMW","245449872","Catching Fire (Hunger Games Trilogy, Book 2)","Digital_Ebook_Purchase","5","0","0","Y","Five Stars","I liked all the books in the series.","2015-08-31","US","2015"
"43179321","R3L0O6L0IJC2OY","B005HF0GKC","392187356","Medium Season 1","Digital_Video_Download","5","0","0","Y","Five Stars","Love that this show includes the family dynamic and how gifts can be passed on our kids.","2015-08-31","US","2015"
"34145327","R24S7NNI6E4VO7","B004ZMWUCU","52387917","The Misremembered Man","Digital_Ebook_Purchase","5","0","0","Y","Wonderful book! Very descriptive and we'll written","Wonderful book!  Very descriptive and well written.","2015-08-31","US","2015"
"4493053","R110R9AIULG32E","B00I6IKSZ0","918624977","Pixel Gun 3D (Pocket Edition) - multiplayer shooter with skin creator","Mobile_Apps","2","0","0","Y","horrible","It does not  let Me play battle","2015-08-31","US","2015"
"11286427","RGX13DZV6JE3U","B00E8KLWB4","488246640","The Secret Society® - Hidden Mystery","Mobile_Apps","4","0","0","Y","hidden pic","A great game but having to touch the winnings during the game is annoying.","2015-08-31","US","2015"
"36668626","R1MHX18KK3VV9D","B00C1S945G","680311115","Star Trek: The Next Generation Season 2","Digital_Video_Download","4","0","0","Y","Four Stars","I love TBG but second season isn't the prime yet, still, very good.","2015-08-31","US","2015"
"25495764","R1TT69QWRKUOWR","B00DZ83IPS","224529197","Erased","Digital_Video_Download","5","0","0","Y","Five Stars","Great movie worth watching.","2015-08-31","US","2015"
"210896","R1MTED1WBJ1NTA","B00F14IM5K","447585788","Monster High Ghoul Spirit Slo Mo Doll","Toys","5","0","0","Y","Five Stars","nice and good price","2015-08-31","US","2015"
"45946560","R217CQPJCP1TFF","B00J0LH16Q","546767502","35th Anniversary Toto Live in Poland","Video DVD","5","0","0","Y","Five Stars","excellent","2015-08-31","US","2015"
"31831671","R2SGXVXY2XNXE","B002CIMKHO","301265489","Gran Torino","Digital_Video_Download","5","0","0","Y","Five Stars","Clint still remains a Bad Ass","2015-08-31","US","2015"
"29919922","R1AQ4YP85S56R8","B00BATG18K","506590385","The Valley of Amazement","Digital_Ebook_Purchase","5","0","0","Y","Another great book by Amy Tan!","I was first introduced to this author a number of years ago in an ethnic literature class in Graduate School, and I've read everything I have found by her since! She never disappoints and &#34;The Valley of Amazement&#34; is no exception.","2015-08-31","US","2015"
"50705429","R1XF6DJO7QJYTM","B0136J8MOC","809696791","Bolero","Digital_Video_Download","1","0","0","Y","One Star","terrible","2015-08-31","US","2015"
"6547166","ROHGIXOZAYFPL","B002MQYOFW","245449872","The Hunger Games (Hunger Games Trilogy, Book 1)","Digital_Ebook_Purchase","5","0","0","Y","Five Stars","I liked the whole series.","2015-08-31","US","2015"
"52899633","R1TRZOQPDVAYWF","B000V39KDO","84818603","300","Digital_Video_Download","3","0","0","Y","Would have rated higher but for the obvious introduction of ...","Would have rated higher but for the obvious introduction of feminist agenda dialogue. I assure you Leonidas was not motivated by his wife to take heroic measures. Such is a projection of contemporary feminism onto the past.","2015-08-31","US","2015"
"41569854","RRRIDNCGV3UEX","0307155102","458722247","Richard Scarry's Best Word Book Ever (Giant Golden Book)","Books","5","0","0","Y","Five Stars","our 2nd copy of this book. it's great","2015-08-31","US","2015"
"47773620","R2HHKFDGMS8HIQ","B001KYH74W","120787425","Round Wire Rim Glasses Costume Accessory","Apparel","5","0","0","Y","These glasses were purchased for an upcoming Halloween party and ...","These glasses were purchased for an upcoming Halloween party and will be worn by my sister to complete her costume.","2015-08-31","US","2015"
"16865434","R230WUOJOHB6R3","B00R3DOCJM","100047036","Hobbit, The: The Battle of the Five Armies (Special Edition) (DVD)","Video DVD","5","0","2","Y","Five Stars","Great find","2015-08-31","US","2015"
"37491815","R3KF8JF3W2DQI2","B005LAIHR2","877921727","Rock of Ages","Video DVD","1","0","1","N","Well I thought this was going to be a great movie because I love music","Well I thought this was going to be a great movie because I love music. But this movie is terrible It's never ending, the dialogue stinks, the casting is okay but why have a movie with a great soundtrack with a terrible movie. I only saw this once and believe me It was a pity to this thing they still call Hollywood Blockbusters.","2015-08-31","US","2015"
"23660898","RG3WF4HCFITKJ","B008IBPMZG","682981764","Downton Abbey Season 2","Digital_Video_Download","5","0","0","Y","Five Stars","Love it! Love it!","2015-08-31","US","2015"
"625284","R2NEG1V73PS9CJ","B000Y7U98C","696690178","Sunshine","Video DVD","5","0","0","Y","MY FAVORITE MOVIE TO DATE!","A spectacular thriller ride of heart, spirit, horror, and an adventure for your mind and your eyes! It's an amazing Sci-Fi movie that I believe is Extremely underrated for what it is! I watched it twice in a row when I first got it!","2015-08-31","US","2015"
