"customer_id","review_id","product_id","product_parent","product_title","product_category","star_rating","helpful_votes","total_votes","verified_purchase","review_headline","review_body","review_date","marketplace","year"
"20545025","R28ZMLIHTW4PMF","B0018OMIZW","357084062","Levi's Men's 550 Relaxed-Fit Jean","Apparel","5","0","0","Y","Five Stars","Levi 550... As expected","2015-08-31","US","2015"
"33247977","RE7N4RVWVP4FY","B0018OTZ4O","366487660","Levi's Men's 560 Comfort-Fit Jean","Apparel","4","0","0","Y","Comfortable, as advertised","Comfortable, as advertised; no complaints. I wonder why they went with a tapered fit; straight leg or boot cut would have been ideal. The denim is pretty heavyweight, so I wouldn't recommend them for summer wear in a warm, humid climate...","2015-08-31","US","2015"
"43023325","R1HJVRMDC3YCJZ","B0018OM618","962243446","Levi's Men's 559 Relaxed Straight Fit Jean","Apparel","5","0","0","Y","As Expected","As Expected","2015-08-31","US","2015"
"51032960","R184QI8OYQGDY5","B0018OQTTI","886124925","Levi's Men's 517 Bootcut Jean","Apparel","5","0","0","N","SEVEN BELT LOOPS - HOOORAYYYY!!!!","FOR THE LAST SEVERAL YEARS LEVIS HAVE BEEN PUTTING ONLY FIVE (5) BELT LOOPS ON THEIR PRODUCT, SO I WAS PLEASED TO FIND THAT THEY HAVE RETURNED TO SEVEN (7) BELT LOOPS AS IN THE PAST SO NOW I DON'T HAVE TO ADD TWO (2).<br />HAVE BEEN WEARING LEVIS FOR THE LAST 70 YEARS AND 517'S SINCE THEY STARTED MAKING THEM SO I WASN'T ABOUT TO CHANGE NOW. HAVE ALWAYS BEEN HAPPY WITH THEM.","2015-08-31","US","2015"
"13908979","RN73QTR7PH86B","B0018VJHAO","970758175","Women's Scrub Set, Assorted Colors, XXS-5X, Plus Sizes Available","Apparel","5","1","1","Y","Great Value and Quality Scrub Set!","This scrub set was perfect! It's well-made and this red-orange color is very flattering! It was for a costume, but it makes me wish I could wear it more iften!","2015-08-31","US","2015"
"23981395","R16RU4HHU5YMJM","B00VRYCGLO","183194229","Mahjong Journey®","Mobile_Apps","2","0","0","Y","Two Stars","Too small for old eyes!","2015-08-31","US","2015"
"14293849","RAOKP5UDDYVMJ","B001ANSS5K","324116661","Paper Towns","Digital_Ebook_Purchase","5","0","0","Y","Amazin***","I love this book. I've been wanting to see the movie but I read the book first i will rate the movie once I watch it.","2015-08-31","US","2015"
"52861401","RDGTVUSSW911K","B000I9X53W","85377715","Tootsie","Digital_Video_Download","5","0","0","Y","and under all the screwball humor is some pretty darned good philosophy","I have lived this movie ever since it came out when I was a kid.  It never fails to pick me up, and under all the screwball humor is some pretty darned good philosophy.","2015-08-31","US","2015"
"129134","R3SE5MY4HTZ90K","B000006OBQ","449780137","Sinatra at the Sands","Music","5","0","0","Y","Five Stars","I purchased this CD for my Dad.  He loves it and listens to it every day.","2015-08-31","US","2015"
"114040","R2WGKHKDDYUBV8","B0028IDXDS","450475749","WubbaNub Brown Monkey Pacifier","Baby","5","0","0","Y","Five Stars","Perfect, love!","2015-08-31","US","2015"
"44534790","R2O8G0DA92HXH5","B001HMJYMU","88508308","Silverado Men's Crushable Wool Felt Hat - Rattler-Blk","Apparel","3","1","1","Y","Not what I consider a ""crushable"" hat","While this is a very nice hat I really wouldn't call it a crushable the way many others are.  There is wire in the brim that can kink and cause it to take on odd shapes if it's crushed","2015-08-31","US","2015"
"49360838","R21ACB9OOECGP","B00HY7VU60","592331046","The White Queen, Season 1","Digital_Video_Download","5","0","0","Y","LOVED it!","I wish they were continuing this series from a selfish perspective! I loved these books, and loved this series. So happy I was finally able to watch it on Prime!","2015-08-31","US","2015"
"51370557","R2B3BLJMDPOAWD","0553418025","803172158","The Martian","Books","5","0","0","N","Martian is a good distraction. It is technically informed","Martian is a good distraction. It is technically informed, creative, has a great story line, and dark humor. The story line is so good that I was worried that the author was going to fritz it up, sooner or later. Which doesn't happen. The writing style doesn't have the literary depth of No Country for Old Men, or the colorful biographic language of The Reaper's Line. (We're dealing with an engineer, after all.) And the man-against-planet theme works (without complications of other humans), in a way that reasoning about something other than physics based variables would not have.<br /><br />This is not a blood and guts, man against nature story line. Despite having blood and guts, and an unyielding struggle against nature. It's not The Right Stuff, or Apollo 13. It's more about a small man, creative willpower, dark humor, and grit. This is it's worth, and what makes it encouraging.","2015-08-31","US","2015"
"13114394","R2VG7573CJV3XJ","B001FB4VXU","150529963","The Big Bang Theory: Season 2","Video DVD","5","0","0","Y","The very best!","Bazinga... as usual.  Excellent.  To paraphrase  Sheldon's mother &#34;what the world needs more of --  humour and lard!!&#34;  ;-)","2015-08-31","US","2015"
"23962762","R3EXE5R1VQ6L08","B00EMXBDMA","803172158","The Martian: A Novel","Digital_Ebook_Purchase","4","0","0","N","Occasionally tedious but frequently ""edge of your seat"" exciting","Well done overall.  Occasionally tedious but frequently &#34;edge of your seat&#34; exciting.  The soon to be released movie should be worth seeing IMO. I would, however,  have liked another chapter or two to fully wrap things up.","2015-08-31","US","2015"
"19983237","R2FDDHK66JNP4U","B00APUYN0I","663935341","Pitch Perfect","Digital_Video_Download","5","0","1","Y","Entertaining","Funny, entertaining and some good singing!","2015-08-31","US","2015"
"5884899","R13NBW6IFVQN6Q","B00H3GZMIE","365698290","In The Lonely Hour [Deluxe Edition]","Music","3","0","0","Y","Three Stars","like just a couple of songs","2015-08-31","US","2015"
"13114394","RQHKJUSYXO1RU","0486414124","569473707","Northanger Abbey (Dover Thrift Editions)","Books","5","0","0","Y","Austen is always a winner","Austen's writing is not only entertaining and realistic, it is artistic and infinitely enjoyable on many levels.","2015-08-31","US","2015"
"44359849","R9MFM070QXE6U","B0090CVJZ4","577429472","AmazonBasics 24k Gold Connector Banana Plugs - 24-Pack (12 Red, 12 Black)","Electronics","2","0","0","Y","Be careful","These plugs do not allow you to screw off the nose pieces...at least mine didn't.  This doesn't make for a tight connection. I do not recommend.  I had to substitute some other ones for the ones I couldn't get the wire tight enough.","2015-08-31","US","2015"
"34413472","R26XRYDJ2AIJES","B00KF7VWBO","551407899","True Detective: Season 1","Digital_Video_Download","4","0","0","Y","Four Stars","very dark, but intriguing... will be watching more","2015-08-31","US","2015"
"30665704","RLNXGO9SON4W8","B00275EHJG","338442261","Toy Story 3","Video DVD","5","0","0","Y","Just what we were looking for","Great","2015-08-31","US","2015"
"33039631","RIZ0640WH3O9D","B00L9B7IKE","627793267","The Girl on the Train: A Novel","Digital_Ebook_Purchase","2","0","0","Y","Sad and futile","Did not like the characters.  Such emptiness<br />I","2015-08-31","US","2015"
"4662189","R2G0YC3U5QN1J3","B00C1BV9Z6","40970689","Jurassic Park","Digital_Video_Download","5","0","0","Y","A classic.","A classic.  Just watched it recently and it's as good as when I watched it as a kid.","2015-08-31","US","2015"
"52648899","R2Y0LE8TSPQT7D","B00AZRBLHO","528269678","The Phoenix Project: A Novel About IT, DevOps, and Helping Your Business Win","Digital_Ebook_Purchase","3","0","0","Y","Three Stars","Great intro to DevOps culture.","2015-08-31","US","2015"
"48872127","R2887EWGXO7KMP","0062082841","844757729","Guillermo del Toro Cabinet of Curiosities: My Notebooks, Collections, and Other Obsessions","Books","5","1","2","Y","Great for the del Toro fans in your life","I got this for my husband and another one for my brother in law, who are both huge del Toro fans. They absolutely loved this book!","2015-08-31","US","2015"
"10774990","R2RRM2ATSU8CPE","B00004TB5B","530484605","The Marshall Mathers","Music","1","0","2","Y","Terrible scratching","I bought this for my fiancée. We opened it, and it was heavily scratched. We returned it, and bought a new one and that one also came scratched. Wouldn't recommend.","2015-08-31","US","2015"
"43955852","R1CIQZMRU59ZWD","B00BVYNSLC","940561470","Orphan Black Season 1","Digital_Video_Download","3","0","0","Y","Three Stars","Its okay not that great.","2015-08-31","US","2015"
"30603265","R25I2UHHP39F51","B004FRX0MY","473764126","Amazon Music [Android]","Mobile_Apps","4","0","0","Y","Four Stars","good stuff","2015-08-31","US","2015"
"16467041","R2O7OR9U0Y3D95","B008JFUUIA","663935341","Pitch Perfect","Video DVD","5","0","1","Y","Five Stars","very enjoyable movie","2015-08-31","US","2015"
"4194120","R36C859FTEECPZ","B0009GAXZW","750830160","Fruit Of The Loom 5.6 oz Heavy Cotton Long Sleeve T-Shirt 4930","Apparel","5","0","0","Y","Five Stars","I love them.","2015-08-31","US","2015"
"108247","R1AP2L7XUX58VS","B0007YR9IU","73253049","Playtex Women's 18 Hour Original Comfort Strap Bra #4693","Apparel","5","0","0","Y","Five Stars","perfect fit,thank you !","2015-08-31","US","2015"
"51227803","R2KJ66281QG4C4","B0008EOBEO","113301132","LEE Men's Stain Resistant Relaxed Fit Flat Front Pant","Apparel","1","0","0","Y","This 38 waist felt like a 35 waist","This 38 waist felt like a 35 waist. Unable to wear. Have many other lees, dockers and so on. All of them were 38 waist and fit well. For some reason this pair just seemed off.","2015-08-31","US","2015"
"12609149","R3JD9J59LLPATL","B0009GHM0G","504585580","Hanes Adult EcoSmart Jersey Polo","Apparel","4","0","0","Y","Overall though the shirts seem pretty good quality and for the money a good value","Based on the sizing chartI I anticipated a more fitted shirt but it is a bit large I am an XL but the chart and reviews seemed to indicate the shirts ran a bit small 2xl is a bit large. Overall though the shirts seem pretty good quality and for the money a good value.","2015-08-31","US","2015"
"29605544","R2PX0JPF76XK48","B0009MZXEC","396283184","Thorlos  Mens  Trail Running  Moderate Padded Ankle - Low Cut Socks |TRMX","Apparel","5","0","0","Y","Five Stars","Excellent fit. Great for every day wear!","2015-08-31","US","2015"
"23939522","R3EWFJZ1XJ3QCO","B0008EODKQ","113301132","LEE Men's Stain Resistant Relaxed Fit Flat Front Pant","Apparel","5","0","0","Y","Five Stars","Color is perfect","2015-08-31","US","2015"
"26302295","RU0R35CEYT3A4","B0007YXUWO","980277202","Playtex Women's Love My Curves (Secrets) Signature Floral Underwire Bra","Apparel","5","0","0","Y","Five Stars","great fit and style","2015-08-31","US","2015"
"14075059","R3MKV94MO7SHQ","B0009JNABS","52587625","Wickers Men's Softsilk Boxer","Apparel","5","0","0","Y","comfortable fit","these are great.  Very comfortable in both summer and winter","2015-08-31","US","2015"
"16462817","R2WPN8OXISLBOZ","B0009MGZGC","204181193","DJ MEN SOLID PERFECT PIMA POLO (BLACK) (XL)","Apparel","5","0","0","Y","Five Stars","Great fit and super-soft.","2015-08-31","US","2015"
"24743030","RMZO7RI19VBPN","B0007YXRUY","725526147","Playtex Women's Comfort Lace Wire-Free Bra","Apparel","5","0","0","Y","Five Stars","Great item; fast shipment, thank you!","2015-08-31","US","2015"
"8598420","R326FMRRQ2GWWG","B0007YR9EE","73253049","Playtex Women's 18 Hour Original Comfort Strap Bra #4693","Apparel","1","0","0","Y","Playtex","I gave it a one star because I couldn't leave it blank. At one time Playtex was a good consistent brand. Not any more. Too small. Cheaply made. Won't re-buy.","2015-08-31","US","2015"
"25755748","R2XGWRZOBRKVKX","B0009MZY5A","213621775","Thorlos Unisex Walking Crew Single Pair","Apparel","5","0","0","N","Five Stars","Perfect fit and very comfortable.  Will order more when I return home.","2015-08-31","US","2015"
"32669005","R1RSEV8SKFBNA6","B0007YXTT8","893585113","Playtex Women's 18-Hour Ultimate Lift And Support Wire-Free Bra","Apparel","5","0","0","Y","AWESOME!","Playtex always works for me. And this one is the best yet!  My 64-year-old-girls needed a lift and this does the trick!  Also, I love the rounded and smooth front - no seams to show.  Those padded t-shirt bras don't have anything on this.  I am going to buy more, in every color they make!","2015-08-31","US","2015"
"16101828","R3HO0R1YSLL4DA","B0009GE3I0","504585580","Hanes Adult EcoSmart Jersey Polo","Apparel","5","0","0","Y","Five Stars","Was purchase for boyfriend and it was appreciated.","2015-08-31","US","2015"
"24912871","R2LYSMKAXSFJQW","B00091SSS6","199553884","Dickies Men's Regular-Fit 5-Pocket Jean","Apparel","3","0","0","Y","Three Stars","had some flaws,maybe seconds","2015-08-31","US","2015"
"52929769","R2HPXI88WKMSQM","B0009JTGSO","84221735","Jerzees Mens 6.5 oz. Cotton Pique Polo (440) -ATHLETIC H -M","Apparel","3","0","0","Y","Three Stars","Nice thickness and durable cotton. Thankfully no itchy tags.  Wrinkly collar tough.","2015-08-31","US","2015"
"13206748","RI77A2OHHQ3N5","B0008EOEW8","822319953","Lee Men's Regular Fit Straight Leg Jean","Apparel","5","0","0","Y","I love these jeans","These are my second pair. I love theses jeans. Have wearing Lee since the 70's and still loving this brand. Both pairs I received fit very well and have a very good quality for the price.","2015-08-31","US","2015"
"20323426","R1IST75O37JXD3","B0007YXTPW","893585113","Playtex Women's 18-Hour Ultimate Lift And Support Wire-Free Bra","Apparel","5","0","0","Y","Five Stars","Well, they don't fit me, but my wife, for whom they were ordered, says they fit her perfectly.","2015-08-31","US","2015"
"48755999","R1TQCPLATPK64K","B00R2LZ41K","100047036","The Hobbit: The Battle of The Five Armies","Digital_Video_Download","5","0","2","Y","Five Stars","Great movie.","2015-08-31","US","2015"
"47828624","R14YATWPBQTY66","B0031Q0XCA","456654618","(500) Days Of Summer","Digital_Video_Download","5","0","1","Y","One word:","refreshing","2015-08-31","US","2015"
"44546654","R2J3GX8PY1B4PM","B009ZQC7MY","459613388","Downton Abbey Season 3","Digital_Video_Download","5","0","0","Y","Five Stars","Just love it!","2015-08-31","US","2015"
"32673986","RBOJ12WRDS8YH","B009LMTDL0","523706930","Lean In: Women, Work, and the Will to Lead","Digital_Ebook_Purchase","5","0","0","N","Empowering","This book is very empowering. I learned alot from it and feel that it would be good to go back to it as I take new steps in my career.","2015-08-31","US","2015"
"44388562","R370HQHML5WLRU","B00ZZ08Q1K","156264553","Downton Abbey Season 5","Digital_Video_Download","5","0","0","Y","I really like this show","I really like this show.","2015-08-31","US","2015"
"33194704","R12WC4J1BXTWQ7","B008Y2X78S","867048609","Boardwalk Empire Season 2","Digital_Video_Download","4","0","0","Y","Fictionalized history but I enjoyed it","Enjoyed it","2015-08-31","US","2015"
"27576874","R1WTFIYW3TINW5","B004PYNEZ0","275959022","Meta LabWear Unisex Colored 40""; Lab Coat","Apparel","3","0","0","Y","ok for keeping debris off of your clothes","Quality is ok... but I only use it in my shop to keep my cloths clean when working. I didn't have a lot of expectations, does seem thin but I don't work in liquids.","2015-08-31","US","2015"
"45324618","R1FQZ2GMDMRMK4","1846574420","474654167","Grey: Fifty Shades of Grey as Told by Christian","Books","5","0","0","Y","Five Stars","Oh My!!!!!","2015-08-31","US","2015"
"44252832","RUX8S4U5BY6ZC","067960085X","548414614","Breakfast at Tiffany's: A Short Novel and Three Stories (Modern Library)","Books","5","0","0","Y","Five Stars","Wonderful writing is always a joy.","2015-08-31","US","2015"
"45528682","R23UNU7C9DKBC1","B00A11AN6O","621061857","Prime Photos from Amazon","Mobile_Apps","4","0","0","N","Four Stars","It​ works good, but there is plenty of room for improvement.","2015-08-31","US","2015"
"42521588","R1IUQWPTPJDLZL","B006OCM0G0","617252870","Restaurant Story","Mobile_Apps","5","0","0","Y","AWESOME","I like it me and my brother both play it :) FUN","2015-08-31","US","2015"
"42702707","R2VIR9HSZY2BNC","B00PCKB8PO","610952534","The Best Exotic Marigold Hotel [Blu-ray]","Video DVD","2","0","1","Y","Two Stars","Great cast, colorful scenery and a week, contrived plot.","2015-08-31","US","2015"
"51725593","R2VAON8DK41K27","B00VFTCGES","672024888","Interstellar","Digital_Video_Download","3","0","1","Y","So, so.","Way too long. Started out good but faded.","2015-08-31","US","2015"
"40278703","R23U7O37MQNU68","B00C1BTWV4","40970689","Jurassic Park","Digital_Video_Download","4","0","0","Y","Original still great!@!!!","Original still holds up well after all these years.","2015-08-31","US","2015"
"16264665","R1AUON7KNXYBH2","B008ROVTEW","971526666","Space Jam","Digital_Video_Download","3","1","2","Y","Kids like it","It's Michael Jordan and Warner Bro cartoon characters for goodness sakes!","2015-08-31","US","2015"
"15232271","R1Z6QQOVVGJDDJ","B00E8KLWB4","488246640","The Secret Society® - Hidden Mystery","Mobile_Apps","5","0","0","Y","Addictive","I only just started playing tonight and I am already hooked. I like that you have the option to have something posted on Facebook or not you have control. I like how they help you along at first the tips were actually helpful. I highly recommend it for those who love hidden object games.","2015-08-31","US","2015"
"49676890","R3JZQ8YYT2UXIM","B00MILGKPI","600191340","Teenage Mutant Ninja Turtles","Digital_Video_Download","1","0","1","Y","Ok the kids like it, but if you grew up in the eighties your not! 😎","Uh.....my god, pretty bad, even if it's on prime. But thank you Amazon for putting this on prime so I didn't have to pay to see how bad it was! My suggestion is if you haven't seen the original or even if you have, I'd watch the first one! So bad, I can't even begin to start with what went wrong here.","2015-08-31","US","2015"
"16790728","R1C38JZB9BLF6L","B00L9B7IKE","627793267","The Girl on the Train: A Novel","Digital_Ebook_Purchase","5","0","0","Y","Five Stars","A real page turner","2015-08-31","US","2015"
"22358649","R2Y3H1XV8YAVN","B001HNHUMA","732100075","Henschel Hats Aussie Breezer Hat","Apparel","5","0","0","Y","Love the hat","Love the hat. It was a little too large, but easily adjusted by simply placing a folded paper towel in the lining to tighten the size a little. Fits great now, and love the airflow. It doesn't over hear my head or move in the wind because of the ventilation. Wide brim increases protection, and looks nice.","2015-08-31","US","2015"
"16731699","R2J5WTWJXHKA46","B00EMXBDMA","803172158","The Martian: A Novel","Digital_Ebook_Purchase","4","0","0","Y","100 Ways to die on Mars","Great human drama","2015-08-31","US","2015"
"17507247","R1EIK2GDHS38IL","B00APJLEGA","386512526","Hotel Transylvania","Digital_Video_Download","5","0","1","Y","If you love Grown-ups with Adam Sandler and his crew... You will like this one!","This move is Grown-ups for the cartoon lover in you.  The Cast from Grown-ups are all here. so if you enjoyed that movie and want to watch somthing funny with the kids.  This is my pick.","2015-08-31","US","2015"
"19901755","R17ITDGOMDXCMC","B00DPM7TIG","615885076","All the Light We Cannot See: A Novel","Digital_Ebook_Purchase","5","0","0","Y","Five Stars","A little slow to start - but a great book.","2015-08-31","US","2015"
"43172816","R3OGX6PVLXOB30","B008Y2X78S","867048609","Boardwalk Empire Season 2","Digital_Video_Download","5","0","0","Y","Five Stars","Good show","2015-08-31","US","2015"
"12580341","R3HW3VKV8LEDWS","B00EMXBDMA","803172158","The Martian: A Novel","Digital_Ebook_Purchase","5","0","0","Y","Solid, Realistic Sci-Fi","This is a solid work of near-present sci-fi with tons of nerdy space, chemistry, physics, etc. details. A good read for anyone who is interested in real space exploration since there's no teleporter or warp drive, just hard science using current thinking about how to carry out a manned Mars mission. (BTW, I had a nerd moment when I had to smile at the mention of &#34;Wind River Systems&#34;. Who would know what that is other than a computer and space nerd?)<br /><br />Its a good man versus nature story too, with a generally hopeful tone since the main character keeps good humor despite all the near death experiences Mars throws at him.","2015-08-31","US","2015"
"15186723","R144IOBD58XIL1","B00CFNUMD0","860007757","Shaun the Sheep Season 2","Digital_Video_Download","5","0","0","Y","Five Stars","Very funny, and clever humor. Adults will enjoy this as much as kids.","2015-08-31","US","2015"
"47366997","R3Q9STG7SR756N","B000BBS82K","597650115","Adult Train Engineer Cap","Apparel","5","0","0","Y","Quality product.","Item was as described and shipped A S A P. Great seller!<br />A quality hat at a reasonable price.","2015-08-31","US","2015"
"10573046","R1AQ9VLOZADLZQ","B000RPGE8A","396599232","HUE Women's Cotton Liner No-Show Sock 6-Pack","Apparel","5","0","0","Y","Five Stars","Great socks, what else can I say lol","2015-08-31","US","2015"
"43539790","R17AU896ZUHPP5","B007W8S2MG","952921136","Persona 4 Golden - PlayStation Vita","Video Games","5","0","0","Y","One of my favorite JRPGs","Words can't really even describe how fantastic this game is.  If you like slice-of-life/dungeon crawler RPGs, this is definitely a game you have to get.  Huge variety in the personalities of the characters make them seem real.  Writing is great, and it feels like there are tons more to do in the game compared to Persona 3.  Not to mention a 40-50 hour playthrough which begs it to be played through a second time for completion-sake.","2015-08-31","US","2015"
"41702127","RUOGR9XVE19X4","B0084ANCBC","463707544","Vanity Fair","Digital_Ebook_Purchase","5","0","0","Y","Five Stars","Condition of book was excellent.","2015-08-31","US","2015"
"22797557","R13YL11WZAEAEY","B0038P59A0","371168051","Sherlock Holmes (2009)","Digital_Video_Download","5","0","1","Y","Five Stars","Action packed, delightful characters.","2015-08-31","US","2015"
"928530","R2Z6CEK87UZ0AX","B003DC8UBI","873134600","Black Hot Pants Seamless 6.5 Inches Short Pants, One Size","Apparel","4","0","0","Y","Great for the price :)","I'm about 5'2&#34;-5'4&#34; and 123-125 pounds and these are quite comfortable. They feel really cool and they cover what they need to. I bought these to wear under skirts but they fit me well enough to just wear with a top.","2015-08-31","US","2015"
"31985940","ROFWL90DWQ7MB","B004GJDQT8","36653526","Amazon Underground","Mobile_Apps","1","1","1","Y","Won't work","I downloaded this, can't use unless updated, but the update keeps erring during install. No free app of the day anymore, and this doesn't work for me! Ugh","2015-08-31","US","2015"
"42574721","R37T88WN6IE4SL","B00688628M","755132112","Band of Brothers Season 1","Digital_Video_Download","5","0","0","Y","War Is Hell","Excellent!  War is ugly.  Anyone who think we should send our young men and women to war should watch this series.","2015-08-31","US","2015"
"45093585","R1KHL53HPIMMOZ","B0063IH60K","414486782","Solitaire","Mobile_Apps","5","0","0","Y","MobilityWare Solitaire review","I like this version.  It's simple and entertaining.","2015-08-31","US","2015"
"14176313","R1358NM7JE3LVN","B004M3GDI4","313520564","Petzl E78CHB PIXA 3 Headlamp","Outdoors","5","0","0","Y","and the low setting is great for most times when I need light in a ...","This headlamp certainly does what I need it to.  I work on wind turbines for a living, and the low setting is great for most times when I need light in a dark area/cabinet/junction box, etc. The dial is much easier and faster to operate than a push button, especially when wearing gloves.  It also comes with a clip that's compatible with Petzl hard hats (which we use), so there's no need to buy an extra headband (or headlamp for that matter).  I can slide this one off my hard hat and onto the soft headband that came with it and get right to work. After pivoting, the light stays secure in that position, and it's ruggedly built. If you use it frequently, it does have a tendency to eat batteries - energizer ultimate lithiums lasted about 2.5 - 3 days of almost continual use.  Other than that, I'm loving this headlamp.","2015-08-31","US","2015"
"22507523","R2DX2W66UK8EX1","B007ZXK08C","93816562","Gone Girl","Digital_Ebook_Purchase","1","1","1","Y","... TO HAVE SUCH SCHEMING CHARACTERS SUPPOSEDLY MARRIED AND IN LOVE. VERY","I THOUGHT IT  IMPOSSIBLE TO HAVE SUCH SCHEMING CHARACTERS  SUPPOSEDLY MARRIED AND IN LOVE. VERY PERTURBING","2015-08-31","US","2015"
"35383383","R1Y3PAC16OY0MV","B00KNWYDU8","779873629","Dragon City","Mobile_Apps","5","0","0","Y","Awesome","In many ways this game is like my singing monsters! It's super fun and no bugs so far! You can play with the world and friends. I LOVE THIS GAME...","2015-08-31","US","2015"
"19967756","RZO72LXG97JYR","B004GJDQT8","36653526","Amazon Underground","Mobile_Apps","3","0","0","Y","Frequent updates","An update every single day?","2015-08-31","US","2015"
"18119462","R4KPKRMTJHLQD","B000SV1PD2","603406728","Kidorable Little Boys' Fireman Rain Boots","Apparel","5","0","0","Y","Durable!","Love them! My little girl had another pair that was given to her and this is her second pair. I know they're supposed to be for boys, but she loves them! They're perfect for stomping in the puddles after a good rain!","2015-08-31","US","2015"
"49195817","R3PYH17W3Z6HLZ","B000QWDQR6","792933508","Squeem 'Perfect Waist' Contouring Cincher","Apparel","5","0","0","Y","I like it!","It's a great buy. I would recommend this. Holds you in and supports your back while being comfortable.","2015-08-31","US","2015"
"13569593","R32F3EWNVT1MAX","B003AU5WEG","197267644","MJ Soffe Men's Long-Sleeve Cotton T-Shirt","Apparel","5","0","0","Y","Five Stars","Very comfortable!","2015-08-31","US","2015"
