"customer_id","review_id","product_id","product_parent","product_title","product_category","star_rating","helpful_votes","total_votes","verified_purchase","review_headline","review_body","review_date","marketplace","year"
"36653231","R2BWTVB4VATMSJ","B004A7YLPY","36328004","Levi's Men's Extra Capacity Leather Slimfold Wallet","Apparel","1","4","5","Y","Not sure why this has a good rating, maybe the product changed","Not sure why this has a good rating, maybe the product changed.<br /><br />The tin and wallet (brown) look great out of the box. I also like the storage space, definitely not a slim wallet but i needed more storage than my last real slim wallet. The mesh ID viewer seems like a good idea, hopefully it will last.<br /><br />The &#34;leather&#34; material is fake junk, I've been using it for about a week and the corners are already degrading. The wallet comes with a paper tag inside, if you rip it off at the perforated line you still have a stub. Don't rip it out all the way because the fake leather is glued to the paper tag and will tear the pleather out with it.<br />I cut the tag flush but that section flips up while the rest is glued to the canvas material inside the wallet. The guy that thought of this should be fired.<br /><br />Overall I think it's a cheaply made wallet and I'll be looking for something else.","2015-08-31","US","2015"
"49430273","R3PQTDUU29C23O","B00494VSK4","615377038","Dogwood - Little Boys Short Sleeve Camouflage Short Set","Apparel","4","0","0","Y","Little Boys Short Sleeve Camouflage","My grandson is tall and thin for his age. The set was slightly small, but given that he is tall, I expected that. It's hard to find things for him that fit in the waist and fit for height. This is cute and comfortable. I needed something inexpensive as a set of back up clothes for when he is at our house in case he messes up the clothes he is wearing. These fit the bill.","2015-08-31","US","2015"
"44245180","R1QI26771MM9PH","B0046M8Q5E","233603603","Alexander Del Rossa Mens Satin Robe, Long Lightweight Loungewear","Apparel","4","0","0","Y","Four Stars","First one was too large; exchanged for correct size and am please with fit and feel.","2015-08-31","US","2015"
"23156345","R1Q3ISR1GDRJTE","B00T3DNKIE","652741483","Go Set a Watchman: A Novel","Digital_Ebook_Purchase","1","0","0","Y","Watchman has fallen asleep","What a disappointment! This novel neither offers the calibre of writing nor plot details of her most famous work and I can see why it was rejected. The characters are undeveloped as is the focus of her story. Seemed like a long short story to me. Just makes me wonder how she made such a quantum leap to be able to write To Kill a Mockingbird - there must have been a very heavy-handed editor (perhaps Truman Capote???)","2015-08-31","US","2015"
"33443436","RI93KZQ63J4FL","B00F2WQKL4","30399391","Antec H20 650 Cooling Kit KUHLER 650 Black","PC","5","1","2","Y","Great product!  Great Value.","So far so good!  Hey for the price you can't beat it!  Also I recommend the larger Antec models of coolers, but this works great!  Also one more final thought to whoever buys this.  They have outstanding customer service!  The first metal bracket for the attachment was week and broke, and I let them know and they sent me out a replacement.  The shipping took a few days but it made it.","2015-08-31","US","2015"
"23885792","R19CXBI7ZPDPPR","B00A2FSXHK","534166270","Minority Report","Digital_Video_Download","5","0","0","Y","Five Stars","Awesome of course!!!","2015-08-31","US","2015"
"2683007","R3AP8PVI7V0O06","0425268284","281387686","Blood Song (A Raven's Shadow Novel)","Books","3","1","1","Y","Good read. This is the first of a series","Good read. This is the first of a series. Movement throughout the story is a bit slow and sluggish, as the writer paints the picture of the characters and their backstory. Has great potential, and look forward to reading the next books in the series...","2015-08-31","US","2015"
"20426829","R3CI0GN8QDIHPB","B00PSLQYWE","156264553","Downton Abbey Season 5","Digital_Video_Download","5","0","0","Y","It always ends too soon.","Just as visually stunning, lush and full of drama as the previous seasons, Season 5 left us wanting more!  From the teenagers to the grandparents, everyone in this household loves it!!","2015-08-31","US","2015"
"30242590","R1QG2QNMUS4YTY","B00PSLQYWE","156264553","Downton Abbey Season 5","Digital_Video_Download","5","0","0","Y","Five Stars","Can't wait for season 6","2015-08-31","US","2015"
"21342028","R2VSRI6ISCQQ5C","B00JVZ0DQG","73538310","FarmVille 2: Country Escape","Mobile_Apps","5","0","0","Y","frosting?","I can't get any frosting from Grandma's glade no matter how many times I go there and I'm not willing to use 100 keys to buy the magician. Otherwise I love this game!!!","2015-08-31","US","2015"
"23930841","R7OMIAU2BGV2S","B006DJ2JSI","919601587","Dictionary - Merriam-Webster","Mobile_Apps","5","0","0","Y","very helpful","This is great for my homework!!!! ;)","2015-08-31","US","2015"
"31717451","RFIHQY4440VI9","B009ZQ8052","833501730","Grave Encounters","Digital_Video_Download","4","0","0","Y","Iwatch a LOT of horror films but I'm rarely unsettled ...","This movie definitely creeps me out; I watch a LOT of horror films but I'm rarely unsettled by them. Seen this one twice and enjoyed it both times--if having a knot in your stomach counts as &#34;enjoyment&#34;, that is.","2015-08-31","US","2015"
"15344737","R2TNA5XVMQAU9N","B005GFPZYK","36488461","American Sniper: The Autobiography of the Most Lethal Sniper in U.S. Military History","Digital_Ebook_Purchase","3","0","0","Y","Interesting perspective.","Reasonably well written autobiography. Interesting story but a bit full of the blind American patriotism that precipitates so many of the world's issues.","2015-08-31","US","2015"
"10172107","R2QF343O6NCU2W","B000FC13E0","245555180","Prey","Digital_Ebook_Purchase","1","0","0","Y","Tedious reading","I felt I was trudging through mud way before I got near the end. The whole book seemed to drag, but I hung in there because i've always liked Crichton's books in the past. Maybe the science and technology was just too unbelievable and seemingly illogical for my brain, but I'm sorry to say I found reading this book to be boring and tedious. The ending didn't make up for the slow pace throughout.","2015-08-31","US","2015"
"9927955","R3BJQX3MJ0KN3N","B00C7KXUOE","790221947","Hannibal Season 1","Digital_Video_Download","5","0","0","Y","Five Stars","Excellent start to a series!","2015-08-31","US","2015"
"11685362","RVZTEYVWUMRWU","B00DZ83IPS","224529197","Erased","Digital_Video_Download","5","0","0","Y","Great movie, full of suspense loved","Great movie,full of suspense loved it","2015-08-31","US","2015"
"10885346","R50UMLI59APKF","B008C20TDG","495389744","It Starts With Food: Discover the Whole30 and Change Your Life in Unexpected Ways","Digital_Ebook_Purchase","5","0","1","Y","BUY NOW !!","BUY NOW !!","2015-08-31","US","2015"
"11531638","R1S5RXYAWCCB3Q","B003VVFGWC","503390821","Veronica Mars Season 2","Digital_Video_Download","5","0","0","Y","Five Stars","Watched all 3 seasons I wish there would have been more.","2015-08-31","US","2015"
"40867315","R2QGT6VUOM0WSG","B000FC0SIM","44310359","On Writing: A Memoir Of The Craft","Digital_Ebook_Purchase","5","0","0","Y","Beneath King's ""gee shucks"" conversational voice and informal approach to the subject lie some of the best pieces of wisdom and","Absolutely invaluable information and anecdotes from one of the giants in the industry.  Beneath King's &#34;gee shucks&#34; conversational voice and informal approach to the subject lie some of the best pieces of wisdom and advice I've ever read on the subject of creative writing.  Sure, many of the points he makes have been made before, but King's delivery and inclusion of meaningful moments from his own life go a long way toward making them accessible to his readers.  I recommend this book to any struggling would-be author who has hit the wall of self-doubt and despair that can stymie one's best efforts - it may be just the nudge you need to get those ideas down on paper/screen again.  It worked for me!","2015-08-31","US","2015"
"24766851","R1AQW076KGZ54I","B00932A66Y","595912171","Headhunters","Digital_Video_Download","4","0","0","Y","Four Stars","Excellent mystery with very good writing and acting","2015-08-31","US","2015"
"38988832","R1Z3LC3WWGG0A","B001J9OP6Q","176495578","Nappa Leather Black Ankle Holster Travel Wallet","Apparel","5","0","0","Y","Five Stars","Worked great traveling throughout Europe.","2015-08-31","US","2015"
"2972004","R1V3WRLRRSMMYJ","B0054TKAZW","875408423","Teen Wolf Season 1","Digital_Video_Download","5","0","0","Y","Great show! Makes you cry","Great show! Makes you cry, makes you laugh. Sometimes the suspense is a little much but it's makes the show!","2015-08-31","US","2015"
"27215680","R24YB4OB84XX9D","B00HGJ18C2","326848133","Solitaire","Mobile_Apps","5","0","0","Y","Five Stars","Fácil y ameno","2015-08-31","US","2015"
"4381482","R1ZEMNSMNWS1FN","B004X75RK4","121115175","The Proposal","Digital_Video_Download","4","0","0","Y","Four Stars","Good movie","2015-08-31","US","2015"
"3198910","R3Q0VMIL6EOYVQ","0199640947","532804749","Paperback Oxford English Dictionary","Books","1","0","1","Y","There are many better resourceful material in internate for example Merriam Webster is ...","It was not what I expected. I could not find many words which I was looking. There are many better resourceful  material in internate for example Merriam Webster is much better.","2015-08-31","US","2015"
"6390892","R87DV98A4AZ82","0062409859","652741483","Go Set a Watchman: A Novel","Books","5","0","1","Y","Five Stars","Another good book by Harper Lee but not quite as good or great as To Kill a Mockingbird.","2015-08-31","US","2015"
"11732525","R2X9O3QWOBTCRM","B00JOT3HQ2","545270466","Geometry Dash Lite","Mobile_Apps","5","0","0","Y","awesome","I love this I think It is awesome because ............<br /><br />When I have to read for school I put on my audio book  turn off the sound and play :)","2015-08-31","US","2015"
"52775263","R24COWZBPFJV1F","0307989704","366130389","Thinking, Fast and Slow","Books","4","0","0","N","Fascinating and frustrating, throws the baby out with the bath water","Kahneman begins with a distinction between System 1, the automatic and seemingly effortless functions of the mind (which basically conflates perception, emotion, and the subconscious), and System 2, the effortful, volitionally controlled \""executive\"" functions of conscious awareness.  He then discusses how the ways in which they typically operate and interact can lead to a variety of predictable effects and systematic biases, such as priming, confirmation bias, the halo effect, etc.  In much of this discussion he takes the contents of System 1 as the given, neglecting the fact that what gets automatized is what's done repeatedly by System 2 (though he does pay some attention to this fact later in the book in his discussion of \""intuition\"", which is reliable precisely when based on lots of practice with good feedback in predictable, e.g. high validity, situations).<br /><br />Next he follows Cass Sunstein's distinction between \""econs\"" (basically theoretically rational agents) and \""humans\"" (basically a descriptive rather than prescriptive account of how people actually make economic decisions), arguing that a rational agent model of economic theory is hopelessly flawed and his brand of behavioral economics is more accurate and useful.  While it's true that a model of human action as inherently rational is inadequate, Kahneman swings to the other extreme and seems to delight in trying to show that it is inherently IRrational (even though he half-heartedly denies this toward the end of the book, it's pretty clear where he stands).<br /><br />Finally he draws a third distinction between the \""experiencing self\"" and the \""remembering self\"", trying to show that people's later evaluations by their remembering self aren't consistent with their actual experience.  Again, there's some very interesting material here, such as how the remembering self's tendency to focus not on the sum total of an experience but on particular moments, especially the peak and the ending, explains the narrative structure of our art forms.  But Kahneman neglects that people can legitimately focus on certain aspects of their experience to the detriment or exclusion of others, and this is not at all necessarily irrational or inconsistent.<br /><br />He also notes that even in measures of the well-being of the experiencing self, there is an unequal distribution with some people experiencing life as almost entirely positive while for others it's largely negative, but doesn't know what to make of this and tentatively attributes it to the effects of poverty, disease, etc.  But the real explanation is implicit in (at least a charitable interpretation of) his theory: it's largely a matter of what you choose to focus on, or to put it in his terminology how you use your System 2 (which will in turn improve your System 1 over time, which Kahneman sometimes seems to recognize but at others to deny).  He even goes on to discuss a bit later how victims of debilitating accidents or disease are only made unhappy by it as long as their \""remembering self\"" dwells on it (and as someone who's been dealing with a chronic illness for a decade and had to learn to appreciate all the good in life, I should know!).<br /><br />The main theme I took away from the book is that most of the errors to which people are prone are caused by failing to take the full context into account, or as Kahneman puts it, What You See Is All There Is.  This comes up again and again in his discussions of overconfidence, framing effects, base rate effects, substitution (which is basically being asked for signal and answering with noise), etc.  Whether you want to think of this as differentiating and integrating, zooming in and out, or in Kahneman's terms of narrow vs. broad framing or taking an \""inside\"" vs. (a more statistical) \""outside\"" view of a situation, it all comes down to the same thing, though again he moves from rightfully pointing out the problems of focusing too narrowly on a particular case to the opposite extreme of only considering the broader context and ignoring the particular details of a given case.  This leads him to some disastrous policy recommendations such as relying exclusively on algorithms to make vital decisions in, e.g., healthcare, which could improve outcomes for many people with fairly common or straightforward problems but would result in \""cookie cutter\"" medicine that would pretty much screw patients like me.  I appreciated his discussion of those who reject the use of such algorithms as \""artificial\"", but again he's rejected one side of a false dichotomy and swung to the other.<br /><br />But the book is full of lots of practical tips as well, such as the use of such formulas to maximize predictive validity (e.g. the Apgar score, for more on which read Atul Gawande's [[ASIN:0312427654 Better]]), how to conduct interviews so as to make better hiring decisions, use reference class forecasting to avoid (or at least mitigate) the planning fallacy, use a pre-mortem to overcome the suppression of doubts and overconfidence, see through the endowment effect and avoid committing the sunk cost fallacy, and much, much more, which alone makes it worth reading.<br /><br />This is a fascinating, and frustrating, book.  Kahneman provides a wealth of information, but his explanatory framework is problematic and leads him to draw many blatantly wrong conclusions, even falling into some of the specific wrong thinking methods he discusses throughout the book (notably theory-induced blindness)!  That said, the careful reader can glean substantial value from it.<br /><br />Three and a half stars.osite extreme of only considering the broader context and ignoring the particular details of a given case.  This leads him to some disastrous policy recommendations such as relying exclusively on algorithms to make vital decisions in, e.g., healthcare, which could improve outcomes for many people with fairly common or straightforward problems but would result in \""cookie cutter\"" medicine that would pretty much screw patients like me.  I appreciated his discussion of those who reject the use of such algorithms as \""artificial\"", but again he's rejected one side of a false dichotomy and swung to the other.<br /><br />But the book is full of lots of practical tips as well, such as the use of such formulas to maximize predictive validity (e.g. the Apgar score, for more on which read Atul Gawande's [[ASIN:0312427654 Better]]), how to conduct interviews so as to make better hiring decisions, use reference class forecasting to avoid (or at least mitigate) the planning fallacy, use a pre-mortem to overcome the suppression of doubts and overconfidence, see through the endowment effect and avoid committing the sunk cost fallacy, and much, much more, which alone makes it worth reading.<br /><br />This is a fascinating, and frustrating, book.  Kahneman provides a wealth of information, but his explanatory framework is problematic and leads him to draw many blatantly wrong conclusions, even falling into some of the specific wrong thinking methods he discusses throughout the book (notably theory-induced blindness)!  That said, the careful reader can glean substantial value from it.<br /><br />Three and a half stars.","2015-08-31","US","2015"
"1175791","R2BRKMWE28J2MR","B00JVZ0DQG","73538310","FarmVille 2: Country Escape","Mobile_Apps","5","0","0","Y","farm","This game is fantastic I don't either want to put it down","2015-08-31","US","2015"
"21483745","R2Z5LMEWI3FT35","B00L9B7IKE","627793267","The Girl on the Train: A Novel","Digital_Ebook_Purchase","2","0","0","Y","Didn't do ""it"" for me.","Didn't live up to the great reviews I read about this book.  The ending was fairly predictable, I figured &#34;who done it&#34; and then became bored.  I was disappointed.","2015-08-31","US","2015"
"13136678","R2MW6OLE0HXM63","B00T3DNKIE","652741483","Go Set a Watchman: A Novel","Digital_Ebook_Purchase","3","0","0","Y","Scout Grows Up","Did not think this was as great as &#34;To Kill a Mockingbird,&#34; a classic.  Too political and disturbing for me.  Scout is a great character, but here also too deep to really love the book.  If one really feels bias towards others all their life, why would they change?  Scout is a true person while others disappoint her.  Would look forward to another book more up beat.","2015-08-31","US","2015"
"11319612","R14RG6K7WI5WAF","B00DA6YEKS","535832345","Words of Radiance (The Stormlight Archive, Book 2)","Digital_Ebook_Purchase","5","0","0","Y","LOVED this book","LOVED this book!!! and the first one. I am so excited about this series and planned 10 book - though definitely nervous about how long it might take to finish! I highly recommend. The characters are amazing; no one is fully &#34;good&#34; or fully &#34;evil&#34;. People cross the lines on both sides with thoughtful and probable character flaws and very real and very difficult decisions. I also love the world these stories are set in- so much detail! The ecology is beautifully described! I cannot wait for the next one!!!","2015-08-31","US","2015"
"44597454","R1TQRTR6VLIJVO","B003B02O7I","934400771","The Testament: A Novel","Digital_Ebook_Purchase","5","0","0","Y","Five Stars","Great author","2015-08-31","US","2015"
"24614010","RHL15PGBA2NVX","B00DZ83IPS","224529197","Erased","Digital_Video_Download","1","0","0","Y","One Star","Great premise. Started great. Fizzled to the point I turned it off before the end.","2015-08-31","US","2015"
"52920182","RS1JGCWGEGZJ9","B00GX59QO2","645382359","Red 2","Digital_Video_Download","5","0","0","Y","I miss ""The Pig ""","Almost as good as the first one. The actors are obviously having a ball as well. They play well together. 007 for the Geritol Generation and plain fun for all.","2015-08-31","US","2015"
"50086780","R2DUH0SQF7XJCH","B00DPM7TIG","615885076","All the Light We Cannot See: A Novel","Digital_Ebook_Purchase","4","0","0","Y","A great novel with great characters","I enjoyed this story a lot. It provided a really vivid picture of the difficulties faced by people during this time period. The author did a good job of building the characters piece by piece, so that you felt you knew them on a deeper level by the end of the story. I highly recommend this novel.","2015-08-31","US","2015"
"25436174","R2I5LMZXF05OOZ","B001HQP632","343659291","Stacy Adams Men's Crushable Wool Felt Snap Brim Fedora Hat","Apparel","5","0","0","Y","Five Stars","it looks expensive I like it","2015-08-31","US","2015"
"50898474","R1333Y1DGQBQHN","B0058DRBOC","944257790","Butterfly Costume Wings Lavender","Apparel","2","0","0","Y","The definition of cheap, single use, crap.","The very definition of poorly made, cheap crap.","2015-08-31","US","2015"
"43976403","R22P0ELTR4LQQZ","B0058HXXT0","934753158","Bruce Lee Kids T-shirt Dragon Awaits Youth Black","Apparel","5","0","0","Y","Nice shirt, good quality","My son is into TaeKwonDo and wanted to have an appropriate shirt to wear so I found this one. He loves it and wears it at least twice a week. The fit is appropriate for the size. The look is good without any glaring issues. The image is centered on the upper part of the shirt in an accurate and pleasing manner. So far no fade or peeling issues and it's been washed several times.","2015-08-31","US","2015"
"13501465","R2QWF6ZMJ9IFWD","B003F3FJQO","723768527","The Scorch Trials (The Maze Runner, Book 2)","Digital_Ebook_Purchase","5","0","0","Y","Cool","The fact I can get it right away with a lot more fun if I was a great way for","2015-08-31","US","2015"
"21346047","R2C9WIBDMHDMKV","B009MF5BXK","490387818","The Expendables 2 [DVD + Digital Copy + UltraViolet]","Video DVD","5","0","0","Y","Love it!","ton of action!  Love it!","2015-08-31","US","2015"
"12018414","R25WRDYCQTOOTQ","B00573QPIQ","457153729","Guns N Roses - Bloody Bullet Soft T-Shirt","Apparel","5","0","0","Y","perfect!","Purchased a medium for the vintage look..tight fit around the arms and chest..length shows the belt...I'm 6&#34;1' 175lbs...perfect!","2015-08-31","US","2015"
"10626211","R1O0DO06F500RW","B00DR0PDNE","343185803","Google Chromecast HDMI Streaming Media Player","Home Entertainment","5","0","0","Y","Five Stars","Thanks","2015-08-31","US","2015"
"19504814","R1YAVFTJHLHHL","B0057X9QKA","719356071","Key Apparel Men's Short-Sleeve Heavyweight Three-Button Henley","Apparel","4","0","0","Y","Four Stars","f","2015-08-31","US","2015"
"24339682","R3FNNJKDGKR44O","B001KWH69U","717059951","Underworks Mens Microfiber Performance Compression Tank 3-Pack","Apparel","5","0","0","Y","Five Stars","Great","2015-08-31","US","2015"
"7387716","R3PTL6SAMBNGRL","B0058EQIO0","872421250","Bajoran Set Costume Accessory Set","Apparel","3","1","1","Y","Good but allergic","I liked it but I think I might have been allergic to either the tape or the nose piece.","2015-08-31","US","2015"
"12114005","RMCPF2P9RCTA0","B0056X70SQ","987386584","Port Authority Men's Textured Hooded Shell Jacket","Apparel","5","0","0","Y","Great jacket.","This jacket is well worth the money. It looks great, feels warm, and has tons of pockets.  The inner lining pocket is huge, you could probably fit an Ipad in there.  Sizing seems perfect. I bought an X-small I am 5'4&#34; 29-30 waist.","2015-08-31","US","2015"
"12404621","R3CTWWAWRIW195","B0058YTRGQ","988215037","Calvin Klein Men's Non Iron Slim Fit Solid  Dress Shirt","Apparel","5","0","0","Y","Five Stars","Excellent Thank You..","2015-08-31","US","2015"
"14092337","R1K84YPTA915T8","B001LRPQEG","140155979","Dockers Big Boys' Reversible Dress Belt","Apparel","5","0","0","Y","Five Stars","served its purpose almost a year later still fits","2015-08-31","US","2015"
"41923733","R3ERYZA3V6BYW3","B0058RT9E8","409599592","Bali Women's Comfort Revolution Wirefree Bra","Apparel","5","0","0","Y","Five Stars","perfect","2015-08-31","US","2015"
"50384652","R3J5GOI4ZKT454","B0055X1NS0","907343521","Maidenform Flexees Women's Shapewear Romper","Apparel","5","0","0","Y","Like it lots!","Surprisingly comfortable and easy to get on and off!  I'm glad I chose this one!","2015-08-31","US","2015"
"37225507","R3N6GQ3LGHX2D8","B00567GPV0","244428636","Cell Block Psycho Adult Plus Costume","Apparel","1","0","0","N","Painfully Cruel to People Living with or Caring for Someone Living with Mental Illness","Most Helpful Customer Reviews<br /><br />Painfully Cruel to Those Living with or Caring for Mental Illness<br /> By  Gayle  on August 30, 2015<br />Size: One SizeColor: Orange<br />I am writing to share a serious matter of importance as it relates to this costume.<br />My younger daughter, once an honor student, athlete and musician before her illness presented during the onset of adolescence, has lived with schizoaffective disorder for the past six years, and was hospitalized as a child. We’ve taken her to UCLA and Stanford, as well as our local hospitals, hoping to make sense of her devastating illness. If you have ever spent anytime visiting a loved one in a mental health treatment facility, I assure you, you would understand that this costume is painfully cruel.<br />Human suffering is not an appropriate inspiration for a Halloween costume. I doubt you would sell a Stage Four Cancer, Holocaust or Slave costume. Why would you sell a costume that makes fun of a severe brain disorder?<br />Stigma only encourages hopelessness and despair. Please reconsider stigmatizing our daughter’s very real illness by removing<br />this costume and other mental illness inspired costumes from your inventory.","2015-08-31","US","2015"
